"job_url","site","title","company","company_url","location","job_type","date_posted","interval","min_amount","max_amount","currency","is_remote","num_urgent_words","benefits","emails","description"
"https://www.indeed.com/viewjob?jk=672ace4e453d3a4b","indeed","Senior Engagement Manager","Lovelytics","https://www.indeed.com/cmp/Lovelytics","Remote, USA","fulltime","2024-12-10","yearly",175000.0,200000.0,"USD",True,0,"","","Lovelytics is seeking a skilled consultant and people leader with experience
delivering and leading strategic Databricks and Machine Learning client
engagements.

This Senior Manager will oversee the success of and play the Engagement
Manager role on a portfolio of client engagements on the Data & AI team.
You'll define project scopes, create project plans, and manage project kick-
offs. The senior manager will also manage the performance, career growth, and
resources for a team of 3-6 other consultants.

In addition to the leadership capabilities for this role, we are looking for
someone who has experience solving complex client problems and providing
solutions related to NLP solutions, deploying AI & ML systems, data
integrations, and data modeling in Databricks.

 **Role Location:** Open to remote candidates in the US in the following
states: AZ, MD, DC, CA, IL, IN, MA, NC, TX, TN, GA, CO, NY, NJ, VA, FL, PA,
WA, OR.  
  
**_This role is not open for work sponsorship at this time._**

 **Primary Job Responsibilities:**

    * Manage projects and across project teams made up of Data Engineers, Scientists and BI specialists, to ensure project milestones are reached within the given timeline and budget allocated
    * Work with the presales team to understand requirements from clients and RFPs to lead the delivery of creative and effective technical solutions.
    * Foster a collaborative work environment on your team, providing direct guidance, assignments, and overall performance and professional development for direct reports.
    * Help lead the growth of the Gen AI offering at Lovelytics
    * Ensure accurate project allocations, forecasting, and other administrative tasks are completed across the team.
    * Establish data governance frameworks, ensuring compliance across all engagements.
    * Orchestrate end-to-end ML workflows, from data preprocessing to model deployment across various projects.
    * Oversee the deployment of machine learning models at scale, ensuring reliability and performance.
    * Support other team members on projects, which can oftentimes mean wearing many different hats
    * Troubleshoot complex data issues on the fly with prospects and clients

 **Our Ideal Candidate's Skills and Experiences:**

    * B.S. in Computer Science or equivalent, MS preferred.
    * 8+ years in data and ML engineering, working with cloud-based data analytics architectures and 4+ years of experience working in a consulting/professional services organization in a client-facing capacity
    * Proven ability to directly manage a team both on a project as well as organizationally, providing feedback and career development.
    * 2+ years experience on the Databricks platform implementing AI/ML projects, including production implementation is required
    * Experience in GenAI development, including LLMS and LangChain, and familiarity with standard GenAI architectural patterns such as RAG and ReACT is required
    * Proficient working with popular NLP frameworks such as Spark NLP or Hugging Face Transformers in pytorch, tensor flow etc
    * Experience developing Machine Learning models and ML Ops processes
    * Excellent communication skills are a MUST, this role is client-facing and managing, and this role requires both written and verbal client management skills.
    * Overall understanding of analytics from analytic engineering to visualization tools

 **What We Promise You:**

    * Exciting projects with great clients in varying departments and verticals across the world
    * The ability to work closely with experienced data engineers and quickly grow and expand your skillset
    * The ability to work closely with all sizes of companies, ranging from Fortune 100 to small local businesses
    * A workplace where you are encouraged to challenge the status quo and develop new technologies, methodologies, and processes
    * A diverse team consisting of data gurus, experience seekers, and entrepreneurial minds that are always pushing to be better

 _  
Lovelytics is an Equal Opportunity Employer. This means you don 't have to
worry about whether your application process will be fair. We consider all
applicants without regard to race, color, religion, age, ancestry, ethnicity,
gender, gender identity, gender expression, sexual orientation, veteran
status, or disability. The salary for this position for candidates in the
United States is $175,000-$200,000, however, Lovelytics aims to bring in
candidates in the middle of this determined band; salary determination is
based on several different factors including but not limited to years of
related experience, skills, and education._

MhqOkcxRuF"
"https://www.indeed.com/viewjob?jk=5442e92608a47c0c","indeed","Technical Program Manager","Analog Devices","https://www.indeed.com/cmp/Analog-Devices","Boston, MA, USA","fulltime","2024-12-10","yearly",154400.0,212300.0,"USD",False,0,"","","Analog Devices, Inc. (NASDAQ:

ADI

) is a global semiconductor leader that bridges the physical and digital
worlds to enable breakthroughs at the Intelligent Edge. ADI combines analog,
digital, and software technologies into solutions that help drive advancements
in digitized factories, mobility, and digital healthcare, combat climate
change, and reliably connect humans and the world. With revenue of more than
$12 billion in FY23 and approximately 26,000 people globally working alongside
125,000 global customers, ADI ensures today's innovators stay Ahead of What's
Possible. Learn more at

www.analog.com

and on

LinkedIn

.

  
Analog Devices (NASDAQ: ADI) designs and manufactures semiconductor products
and solutions. We enable our customers to interpret the world around us by
transforming physical phenomena - sound, light, radio waves, voltages,
currents, and motion - into high-fidelity data. Our mission is to build the
Intelligent Edge, where AI transforms how we solve challenging problems by
combining deep application knowledge, close customer relationships,
extraordinary data, advanced circuits, and breakthrough algorithms.

  
Position Description:

The CTO Operations and Program Management team is seeking an experienced
Program Manager to join our team to lead planning and delivery of AI/ML
projects. The ideal candidate will have a strong track record in managing
complex technology development projects with a leaning towards implementing
efficient operations and process improvements. Portfolio will include R&D and
other technology projects that bring together systems, software, AI/ML, and
other components.

The Program Manager is responsible for independently managing a portfolio of
projects many of which are across different market applications, involve
collaborators and stakeholders from many different ADI teams, and come in a
variety of product form factors. This role requires someone who has a
strategic mindset, can lead and influence without authority and collaborate
across diverse stakeholders from senior leaders to individual contributors and
support staff.

Responsibilities:

    * Lead a portfolio of projects/programs for the AI team in addition to supporting other CTO office projects and initiatives as needed.
    * Collaborate with internal teams, external vendors, and business partners to gather requirements, address concerns, and ensure alignment with project objectives.
    * Work closely with project sponsor, technical lead and cross-functional teams to develop project plans (scope, work-breakdown/milestones, timelines) and manage to these plans within budget and schedule.
    * Identify, escalate, and mitigate program risks, including managing change requests in a timely manner.
    * Monitor and provide regular project updates, performance metrics, and status reports to stakeholders (including ADI leadership).
    * Develop and refine program management practices to enhance project planning, execution, risk management, reporting efficiency and be a change agent to facilitate adoption of new processes and methodologies.

Qualifications and Skills:

    * Bachelor's or Master's degree (technical field preferred).
    * 10+ years of experience in managing technology projects, technical programs or owning a software product (including running projects through a full development cycle-agile and hybrid approaches).
    * Demonstrated expertise in successfully managing cross-functional teams and vendors spanning diverse geographical locations.
    * Experience in successfully employing collaboration and project management tools such as MS Project, Smartsheet, Atlassian Suite - JIRA, Confluence, GitHub, etc.
    * Proven ability to navigate organizational silos and to influence and inspire peers across disciplines.
    * Able to deal with high levels of ambiguity and drive clarity for all stakeholders (project teams, partners and senior leadership).
    * Communication style that conveys expertise, clarity, and confidence.
    * Analytical mindset with strong problem-solving skills

 _For positions requiring access to technical data, Analog Devices, Inc. may
have to obtain export licensing approval from the U.S. Department of Commerce
- Bureau of Industry and Security and/or the U.S. Department of State -
Directorate of Defense Trade Controls. As such, applicants for this position -
except US Citizens, US Permanent Residents, and protected individuals as
defined by 8 U.S.C. 1324b(a)(3) - may have to go through an export licensing
review process._

 _Analog Devices is an equal opportunity employer. We foster a culture where
everyone has an opportunity to succeed regardless of their race, color,
religion, age, ancestry, national origin, social or ethnic origin, sex, sexual
orientation, gender, gender identity, gender expression, marital status,
pregnancy, parental status, disability, medical condition, genetic
information, military or veteran status, union membership, and political
affiliation, or any other legally protected group._

 _EEO is the Law:_

 _Notice of Applicant Rights Under the Law_

 _._

Job Req Type: Experienced  

Required Travel: Yes, 10% of the time  

Shift Type: 1st Shift/Days

The expected wage range for a new hire into this position is $154,400 to
$212,300.

    * Actual wage offered may vary depending on work location, experience, education, training, external market data, internal pay equity, or other bona fide factors.

    * This position qualifies for a discretionary performance-based bonus which is based on personal and company factors.

    * This position includes medical, vision and dental coverage, 401k, paid vacation, holidays, and sick time, and other benefits."
"https://www.indeed.com/viewjob?jk=b8d0ab034969d076","indeed","Research Associate","Stanford University","https://www.indeed.com/cmp/Stanford-University","Stanford, CA, USA","fulltime","2024-12-10","yearly",82468.0,106256.0,"USD",False,0,"","","The Stanford Prevention Research Center (SPRC) is a consortium of renowned
experts who are world leaders in investigating ways to prevent disease and
promote health. Their work is focused on identifying the most practical,
science-based solutions for addressing some of society's most pervasive and
preventable health issues, such as obesity, diabetes, hypertension, and other
chronic conditions and to raise the standards of scientific investigation that
matters for health. SPRC investigators are collaborating on numerous, long-
term projects designed to translate research into effective ways to promote
well-being at every stage of life.

Dr. Ying Chen's lab at SPRC focuses on developing and applying advanced
statistical methodologies for the collection, management, and analysis of data
from epidemiological studies. The Chen lab is seeking a Research Data Analyst
to support a new international study on cancer early detection and etiology.
The Research Data Analyst will manage and integrate study data from
international and domestic study sites into a central database for analysis,
ensuring data quality and consistency through rigorous quality control in
compliance with study protocols on secure data transfer and management. The
duties for this role include programming a REDCap portal for data collection,
and using programs like SAS, STATA, and R to develop data analysis pipelines.
The Research Data Analyst will also generate data reports and visualizations
for study communications, and address data-related questions from the study
PI, sponsor, and other stakeholders. In addition, the Research Data Analyst
will be responsible for identifying, troubleshooting, and resolving issues
with data transfer and integration into the analytic dataset.

**Duties include:**

    * Collect, manage and clean datasets.
    * Employ new and existing tools to interpret, analyze, and visualize multivariate relationships in data.
    * Create databases and reports, develop algorithms and statistical models, and perform statistical analyses appropriate to data and reporting requirements.
    * Use system reports and analyses to identify potentially problematic data, make corrections, and determine root cause for data problems from input errors or inadequate field edits, and suggest possible solutions.
    * Develop reports, charts, graphs and tables for use by investigators and for publication and presentation.
    * Analyze data processes in documentation.
    * Collaborate with faculty and research staff on data collection and analysis methods.
    * Provide documentation based on audit and reporting criteria to investigators and research staff.
    * Communicate with government officials, grant agencies, and industry representatives.

**DESIRED QUALIFICATIONS:**

    * Previous training and/or experience in statistics or biostatistics.
    * Background in statistical computing.
    * Proficiency with REDcap and statistical packages, such as SAS and R.
    * Excellent computer skills with the ability to optimize the use of available software.
    * Ability to work on multiple projects simultaneously.
    * Experience collaborating with others to determine what data is needed, what data exists, and how best to extract the data in a useful format.
    * Strong oral and written communication skills.

**EDUCATION & EXPERIENCE (REQUIRED):**

    * Bachelor's degree or a combination of education and relevant experience. Experience in a quantitative discipline such as economics, finance, statistics or engineering.

**KNOWLEDGE, SKILLS AND ABILITIES (REQUIRED):**

    * Substantial experience with MS Office and analytical programs.
    * Strong writing and analytical skills.
    * Ability to prioritize workload.

**CERTIFICATIONS & LICENSES:**

    * None

**PHYSICAL REQUIREMENTS*:**

    * Sitting in place at computer for long periods of time with extensive keyboarding/dexterity.
    * Occasionally use a telephone.
    * Rarely writing by hand.

**WORKING CONDITIONS:**

    * Some work may be performed in a laboratory or field setting.

**WORKING STANDARDS:**

    * Interpersonal Skills: Demonstrates the ability to work well with Stanford colleagues and clients and with external organizations.
    * Promote Culture of Safety: Demonstrates commitment to personal responsibility and value for safety; communicates safety concerns; uses and promotes safe behaviors based on training and lessons learned.
    * Subject to and expected to comply with all applicable University policies and procedures, including but not limited to the personnel policies and other policies found in the University's Administrative Guide, http://adminguide.stanford.edu/.

**The expected pay range for this position is $82,468 to $106,256 per annum.**

**Stanford University provides pay ranges representing its good faith estimate
of what the university reasonably expects to pay for a position. The pay
offered to a selected candidate will be determined based on factors such as
(but not limited to) the scope and responsibilities of the position, the
qualifications of the selected candidate, departmental budget availability,
internal equity, geographic location and external market pay for comparable
jobs.**

**At Stanford University, base pay represents only one aspect of the
comprehensive rewards package. The Cardinal at Work website (**
**https://cardinalatwork.stanford.edu/benefits-rewards** **) provides detailed
information on Stanford 's extensive range of benefits and rewards offered to
employees. Specifics about the rewards package for this position may be
discussed during the hiring process.**

**Why Stanford is for You**

Imagine a world without search engines or social platforms. Consider lives
saved through first-ever organ transplants and research to cure illnesses.
Stanford University has revolutionized the way we live and enrich the world.
Supporting this mission is our diverse and dedicated 17,000 staff. We seek
talent driven to impact the future of our legacy. Our culture and unique perks
empower you with:

    * **Freedom to grow.** We offer career development programs, tuition reimbursement, or audit a course. Join a TedTalk, film screening, or listen to a renowned author or global leader speak.
    * **A caring culture.** We provide superb retirement plans, generous time-off, and family care resources.
    * **A healthier you.** Climb our rock wall or choose from hundreds of health or fitness classes at our world-class exercise facilities. We also provide excellent health care benefits.
    * **Discovery and fun.** Stroll through historic sculptures, trails, and museums.
    * **Enviable resources.** Enjoy free commuter programs, ridesharing incentives, discounts and more.

_Consistent with its obligations under the law, the University will provide
reasonable accommodations to applicants and employees with disabilities.
Applicants requiring a reasonable accommodation for any part of the
application or hiring process should contact Stanford University Human
Resources by submitting a_ _contact form_ _._

  

  
_Stanford is an equal employment opportunity and affirmative action employer.
All qualified applicants will receive consideration for employment without
regard to race, color, religion, sex, sexual orientation, gender identity,
national origin, disability, protected veteran status, or any other
characteristic protected by law._

  

  
_The job duties listed are typical examples of work performed by positions in
this job classification and are not designed to contain or be interpreted as a
comprehensive inventory of all duties, tasks, and responsibilities. Specific
duties and responsibilities may vary depending on department or program needs
without changing the general nature and scope of the job or level of
responsibility. Employees may also perform other duties as assigned._"
"https://www.ziprecruiter.com/jobs//j?lvk=YsazZOiT48Y79jipkMC00g","zip_recruiter","Machine Operator Flavor Production Environment","Aerotek","","Northbrook, IL, USA","contract","2024-12-11","hourly",24.0,24.0,"USD","",0,"","","**Job Title: Spray Dry Operator in Northbrook IL!**

    * Shift Schedules: Currently hiring for 2nd shift (2pm-10:30pm M-F) and 3rd shift (10pm-630am)
    * Training would occur during 1st shift for 1-2 week depending on learning curve
    * Pay: Starting pay rate is $24.00 per hour (Plus $1.00 shift differential for 2nd shift, and $2.00 shift differential for 3rd shift)

Job Description

    * Set-up, operate, and maintain spray dry machinery within department to meet production goals.
    * Read and understand formula specifications, to ensure product made to order.
    * Use computer system and handle related documentation
    * Use scales for accurate measurements of liquids and dry ingredients
    * Operate a forklift to move product around the production floor
    * Have computer knowledge and handle written compounder materials
    * Select appropriate tank based on manufacturing requirements and batch size
    * Follow GMP, safety guidelines, and procedures

Qualifications:

    * Experience within the food manufacturing industry, flavoring industry, or another relating GMP regulated setting.
    * Familiar with machine set-up, troubleshooting, and change-overs
    * Forklift experience (or willingness to be trained/certified to operate forklift equipment.
  
Pay and Benefits

The pay range for this position is $24.00 - $25.00

About Aerotek:

We know that finding work is hard, and finding meaningful work is harder.
Aerotek connects 180,000+ light industrial and skilled trades workers with
14,000+ employers each year, helping our workers navigate an evolving labor
market and find jobs that meets their goals, skills and interests. Since 1983,
we have provided a variety of career opportunities across North American
industry - from short-term assignments at Fortune 500 companies where you can
build your skills, to long-term opportunities where you can play a vital role
solving for companies' construction, manufacturing and maintenance challenges.
Our 1,500+ experienced recruiters across 250+ offices work relentlessly to put
our workforce in a position to thrive. Let us rise to meet your challenges and
put our people-are everything spirit to the test as your career continues to
grow.

Aerotek offers weekly pay, employee benefits including medical, dental &
vision, life insurance, health advocacy and employee assistance programs, a
401(k) plan, and employee discounts.

The company is an equal opportunity employer and will consider all
applications without regards to race, sex, age, color, religion, national
origin, veteran status, disability, sexual orientation, gender identity,
genetic information or any characteristic protected by law."
"https://www.ziprecruiter.com/jobs//j?lvk=C8YaRLDHeaUTxsesCxmjxQ","zip_recruiter","Intern, Machine Learning, Hybrid","Ulta Beauty, Inc.","","Bolingbrook, IL, USA","","2024-12-10","hourly",14.0,25.0,"USD","",0,"","","Collaborate with AI/ML team to design, develop and implement **machine**
**learning** models for various retail uses cases like personalization,
forecasting, sentiment analysis etc. * Support data collection ..."
"https://www.ziprecruiter.com/jobs//j?lvk=N1Y5jxSIHK_aZCyw_YvLig","zip_recruiter","Senior Consultant, Banking Practice","West Monroe","","Chicago, IL, USA","","2024-12-10","yearly",124500.0,143500.0,"USD","",0,"","","Experience with emerging technologies related to data, AI, and **machine**
**learning**. Qualifications * Bachelor's degree or equivalent experience
required * At least 3-5+ combined years of Financial ..."
"https://www.ziprecruiter.com/jobs//j?lvk=hvLyLed3RuWJFYjis0wbJQ","zip_recruiter","Lead Data Engineer, Data Mgmt Optimization - Shopping (Remote)","Capital One","","Chicago, IL, USA","","2024-12-07","","","","","",0,"","","Work with a team of developers with deep experience in **machine**
**learning** , distributed microservices, and full stack systems * Utilize
programming languages like Java, Go, and Python and data platforms ..."
"https://www.ziprecruiter.com/jobs//j?lvk=WSFaQgzK5Ai4sqQl-8Pwgg","zip_recruiter","Data Engineer","EDGE","","Chicago, IL, USA","","2024-12-07","yearly",80000.0,150000.0,"USD","",0,"","","Understanding of **machine** **learning** workflows and familiarity with ML
Ops tools and practices * Experience with version control (GitHub) and CI/CD
pipelines for data applications * Strong problem ..."
