"job_url","site","title","company","company_url","location","job_type","date_posted","interval","min_amount","max_amount","currency","is_remote","num_urgent_words","benefits","emails","description"
"https://www.indeed.com/viewjob?jk=2e413313b9269287","indeed","Patient Experience Manager","Johnson & Johnson","https://www.indeed.com/cmp/Johnson-&-Johnson","Titusville, NJ, USA","fulltime","2024-12-10","yearly",120000.0,207000.0,"USD",False,0,"","","At Johnson & Johnson Innovative Medicine, what matters most is helping people
live full and healthy lives. We focus on treating, curing, and preventing some
of the most devastating and complex diseases of our time. And we pursue the
most promising science, wherever it might be found.

We deliver on the promise of new treatments and ways to improve the lives of
individuals with serious disease. Built upon a legacy of creative firsts,
Johnson & Johnson Innovative Medicine pursues advancing patient care with
neuroscience, pulmonary hypertension, immunology, and oncology solutions.
Please visit www.jnj.com for more information.

We are Johnson & Johnson. Our mission drives us. Our patients inspire us. We
collaborate with the world for the health of everyone in it.

Job Description

Johnson and Johnson Innovative Medicine is seeking a Senior Manager, Mood
Patient Experience in Titusville, New Jersey.

Johnson and Johnson Innovative Medicine is committed to raising the bar on
Patient Experience (Px), building a new center of excellence - the Patient
Engagement and Customer Solutions (PECS) organization - that will create more
personalized, seamless, and supportive experiences for patients during their
treatment journey.

The Sr. Manager, Mood Patient Experience (Px), Neuroscience is responsible for
shaping and executing fulfillment and adherence strategy for to support the
end-to-end patient experience for patients with Major Depressive Disorder
(MDD) and/or Treatment Resistance Depression (TRD). You will be responsible to
translate customer insights into a holistic and integrated strategy that
shapes patient support service design approach for benefit investigations,
contracted specialty pharmacy support services, and nursing navigator support
services to help patients start and stay in treatment. The role will also
require implementation of strategy through customer-facing tactical
development as well as training for a variety of constituents.

You will be a member of the Neuroscience Px team, working closely with the
patient solutions teams - including field-based access, patient access and
affordability solutions, pharmacy solutions, patient and caregiver solutions,
and supplier management and operational excellence - to deliver, measure and
optimize the patient journey, ensuring that more patients can start and stay
on therapy. You will also work across the brand marketing, market access,
medical affairs, REMS team, supply chain, trade, and multiple field teams to
deliver a patient experience that delights the patient and supports business
strategy and objectives.

A Day in the Life

Every patient's healthcare experience is unique - shaped by personal
experiences and beliefs, the presence or absence of support networks, provider
and payer dynamics, and socioeconomic factors. For many patients, the decision
to start or stop a treatment is overwhelming. Janssen recognizes this, and
wants to create an experience that is personalized, helpful, and hopeful.

The Sr. Manager, Mood Patient Experience, Neuroscience works in service to our
patients, as an advocate for their needs. Day-to-day responsibilities include:

      * Px Strategy: Leverage disrupter competency to optimize an insight-based End-to-End fulfillment and persistency strategy leveraging research, data, market dynamics, and competitive assessments to inform solution choices inclusive of hub services, affordability services, distribution/dispense, REMS requirements, and nurse navigator support
      * Advancing Equity in Healthcare: Advance health equity by uncovering disparities and developing strategies to support better treatment outcomes for underserved populations impacted by their specific mood disorder
      * Program Communications: Help develop compelling and relevant communications to drive awareness and understanding towards MDD/TRD patient engagement programs and support services which focus on on-boarding the prescriber and patient to utilize mood patient support programs
      * Customer-Centric Design Process: Engage patients, caregivers, and providers in co-creating and continuously optimizing solutions by leveraging value creator competency. This includes ownership of all stakeholder insight generation that will inform strategy and solutions
      * Goal Setting: Define KPIs and establish metrics and goals for Px fulfillment and persistency strategy and solutions
      * Program Design: Inform requirements for Px solutions and ensure optimal pull-through
      * Orchestration: Help lead program core teams and ensure required integration of PECS solutions teams, REMS team, brand team, field teams, access teams, supply chain, and trade
      * Communications Planning: Lead planning efforts for communications (targeting, messaging, creative, channels) and training in support of Px programs - influencing indirectly through brand patient and professional marketing teams
      * Measurement & Reporting: Report on End-to-End Px performance through the use of PECS dashboards, research, and analytics resources
      * Training: Help lead training initiatives to ensure strong delivery of patient experience initiatives
      * Program Optimization: Work closely with program owners in the PECS solutions teams to identify and pull through opportunities to optimize programs
      * Culture: Support a culture of learning, smart risk-taking and experimentation
      * Diversity & Inclusion: Create an inclusive environment in support of the company's commitment to equal employment opportunity and the value of a diverse work force.
      * Leadership & Ethics: Model ethical, Credo-based leadership with deep knowledge and respect for legal and compliance requirements

About You

You are compassionate and empathetic, putting yourself in the shoes of the
patients you support and the providers who care for them. You are passionate
about delivering a great support experience that patients will remember and
want to tell other people about. You welcome the challenge of working in a
highly visible, highly accountable role where you can meaningfully impact the
health and wellbeing of others. You feel energized to be part of a team that
is building new capabilities and ways of working. You consistently deliver
great results, but even when you fall short - you learn from it.

The anticipated base pay range for this position is $120,000 to $207,000.

The Company maintains highly competitive, performance-based compensation
programs. Under current guidelines, this position is eligible for an annual
performance bonus in accordance with the terms of the applicable plan. The
annual performance bonus is a cash bonus intended to provide an incentive to
achieve annual targeted results by rewarding for individual and the
corporation's performance over a calendar/performance year. Bonuses are
awarded at the Company's discretion on an individual basis.

      * Employees and/or eligible dependents may be eligible to participate in the following Company sponsored employee benefit programs: medical, dental, vision, life insurance, short- and long-term disability, business accident insurance, and group legal insurance.
      * Employees may be eligible to participate in the Company's consolidated retirement plan (pension) and savings plan (401(k)).
      * This position is eligible to participate in the Company's long-term incentive program.
      * Employees are eligible for the following time off benefits:- Vacation - up to 120 hours per calendar year
      * Sick time - up to 40 hours per calendar year; for employees who reside in the State of Washington - up to 56 hours per calendar year
      * Holiday pay, including Floating Holidays - up to 13 days per calendar year of Work, Personal and Family Time - up to 40 hours per calendar year
  
  

      * Additional information can be found through the link below. https://www.careers.jnj.com/employee-benefits

The compensation and benefits information set forth in this posting applies to
candidates hired in the United States. Candidates hired outside the United
States will be eligible for compensation and benefits in accordance with their
local market.

At Johnson & Johnson, we're on a mission to change the trajectory of health
for humanity. That starts by creating the world's healthiest workforce.
Through cutting-edge programs and policies, we empower the physical, mental,
emotional and financial health of our employees and the ones they love. As
such, candidates offered employment must show proof of COVID-19 vaccination or
secure an approved accommodation prior to the commencement of employment to
support the well-being of our employees, their families and the communities in
which we live and work.

Johnson & Johnson is an Affirmative Action and Equal Opportunity Employer. All
qualified applicants will receive consideration for employment without regard
to race, color, religion, sex, sexual orientation, gender identity, age,
national origin, or protected veteran status and will not be discriminated
against on the basis of disability.

For more information on how we support the whole health of our employees
throughout their wellness, career and life journey, please visit
www.careers.jnj.com.

  

## **Qualifications**

Qualifications:

      * Bachelor's degree required; MBA or other related advanced degree preferred.
      * A minimum of 6 years of healthcare business experience (EX: sales, marketing, payer/access experience, operations, supply chain, analytics) is required, of which 3 years demonstrated marketing and/or customer service experience.
      * Experience in more than one of the areas below is required (a mix of experiences across several of these domains is preferred):
  

Pharmacy Channel Experience

Professional, Market Access, or Direct to Patient Brand Marketing

Services, and/or customer experience marketing

Business planning

Product or Service launch

Strategy development

Field experience (demand or non-demand generation field teams)

Working across a matrixed organization

Experience with predictive models and machine learning

Digital marketing and/or CRM experience

Change management

P&L management

  

      * Communication. Excellent oral and written communication skills, including the ability to manage conflict and defuse difficult situations.
  
  

      * Relationship building. Excellent interpersonal skills with a demonstrated track record for forging strong, productive relationships with a diverse array of customers and colleagues.
  
  

      * Collaboration. Effectively work in a team environment that will require you to coordinate activities and build partnerships across multiple internal/external organizations.
  
  

      * Resourcefulness. Skilled in using personal knowledge and any other available resources to resolve problems for customers and ensure their satisfaction.
  
  

      * Accountability. Eager to set ambitious goals and take ownership for results. Proactive defining actions and following through.
  
  

      * Flexibility. Can dynamically adjust priorities due to changing circumstances. An agile learner who is comfortable operating in complex environments.
  
  

      * Innovation. Ability to try to things based on strong business rationale. A leader who is not afraid to fail and learn and is able to shape ambiguity.
  

Travel. This position is based in Titusville, NJ, requires up to 3 days in the
office, and requires up to 20% domestic travel."
"https://www.indeed.com/viewjob?jk=80a53774f474c119","indeed","Data Scientist","Booz Allen","https://www.indeed.com/cmp/Booz-Allen-Hamilton","Washington, DC, USA","fulltime","2024-12-10","yearly",96600.0,220000.0,"USD",True,0,"","","Predictive Analytics Data Scientist

 **The Opportunity:**

As a data scientist, you're excited at the prospect of unlocking the secrets
held by a data set, and you're fascinated by the possibilities presented by
IoT, machine learning, and artificial intelligence. In an increasingly
connected world, massive amounts of structured and unstructured data open new
opportunities. As a data scientist at Booz Allen, you can help turn these
complex data sets into useful information to solve global challenges. Across
private and public sectors from fraud detection to cancer research to national
intelligence, we need you to help find the answers in the data.

On our team, you'll use your leadership skills and data science expertise to
create real-world impact. You'll work closely with clients to understand their
questions and needs, and then dig into their data-rich environments to find
the pieces of their information puzzle. You'll guide teammates and lead the
development of algorithms and systems. You'll use the right combination of
tools and frameworks to turn sets of disparate data points into objective
answers to advise your clients as they make informed decisions. Ultimately,
you'll provide a deep understanding of the data, what it all means, and how it
can be used.

Work with us as we use data science for good.

Join us. The world can't wait.

 **You Have:**

      * 5+ years of experience with data exploration, data cleaning, data analysis, data visualization, or data mining
      * 5+ years of experience with statistical and general-purpose programming languages for data analysis
      * 5+ years of experience analyzing structured and unstructured data sources
      * Experience developing predictive data models, quantitative analyses, and visualization of targeted data sources
      * Experience leading the development of solutions to complex programs
      * Experience with natural language processing, text mining, or machine learning techniques
      * Experience in the development of algorithms leveraging R, Python, or SQL/NoSQL
      * Secret clearance
      * Bachelor's degree
      * CompTIA Security+ CE Certification

 **Nice If You Have:**

      * Experience with distributed data or computing tools, including MapReduce, Hadoop, Hive, EMR, Kafka, Spark, Gurobi, or MySQL
      * Experience with visualization packages, including Plotly, Seaborn, or ggplot2
      * Bachelor's degree in CS, Data Science, Computer Engineering, or Statistics

 **Clearance:**

Applicants selected will be subject to a security investigation and may need
to meet eligibility requirements for access to classified information; Secret
clearance is required.

 **Compensation**

At Booz Allen, we celebrate your contributions, provide you with opportunities
and choices, and support your total well-being. Our offerings include health,
life, disability, financial, and retirement benefits, as well as paid leave,
professional development, tuition assistance, work-life programs, and
dependent care. Our recognition awards program acknowledges employees for
exceptional performance and superior demonstration of our values. Full-time
and part-time employees working at least 20 hours a week on a regular basis
are eligible to participate in Booz Allen's benefit programs. Individuals that
do not meet the threshold are only eligible for select offerings, not
inclusive of health benefits. We encourage you to learn more about our total
benefits by visiting the Resource page on our Careers site and reviewing Our
Employee Benefits page.

Salary at Booz Allen is determined by various factors, including but not
limited to location, the individual's particular combination of education,
knowledge, skills, competencies, and experience, as well as contract-specific
affordability and organizational requirements. The projected compensation
range for this position is $96,600.00 to $220,000.00 (annualized USD). The
estimate displayed represents the typical salary range for this position and
is just one component of Booz Allen's total compensation package for
employees. This posting will close within 90 days from the Posting Date.

 **Identity Statement**

As part of the application process, you are expected to be on camera during
interviews and assessments. We reserve the right to take your picture to
verify your identity and prevent fraud.

 **Work Model**  
Our people-first culture prioritizes the benefits of flexibility and
collaboration, whether that happens in person or remotely.

      * If this position is listed as remote or hybrid, you'll periodically work from a Booz Allen or client site facility.
      * If this position is listed as onsite, you'll work with colleagues and clients in person, as needed for the specific role.

 **EEO Commitment**

We're an equal employment opportunity/affirmative action employer that
empowers our people to fearlessly drive change - no matter their race, color,
ethnicity, religion, sex (including pregnancy, childbirth, lactation, or
related medical conditions), national origin, ancestry, age, marital status,
sexual orientation, gender identity and expression, disability, veteran
status, military or uniformed service member status, genetic information, or
any other status protected by applicable federal, state, local, or
international law."
