"job_url","site","title","company","company_url","location","job_type","date_posted","interval","min_amount","max_amount","currency","is_remote","num_urgent_words","benefits","emails","description"
"https://www.indeed.com/viewjob?jk=cc14151546a797f9","indeed","Director","Headspace","https://www.indeed.com/cmp/Headspace","Remote, USA","","2024-12-11","yearly",198450.0,270113.0,"USD",True,0,"","","**About the** **Director, AI** **at Headspace:**

_At Headspace, you'll have the unique opportunity to shape the future of AI in
mental healthcare, driving innovative, impactful solutions that touch the
lives of millions around the globe. Our mission is to improve the health and
happiness of people worldwide, and your leadership will be central to
advancing cutting-edge AI-driven technologies that transform how individuals
access and experience mental health support._

_As the Director of AI, you will lead groundbreaking initiatives across
diverse and dynamic business areas, from enhancing user engagement to
delivering highly personalized care at scale. You'll oversee the research,
design, implementation, and optimization of advanced, responsible AI systems
that are not only scalable and secure but also set the standard for innovation
in the health tech industry. Your work will focus on ensuring our products
remain at the forefront of technology, delivering measurable impact and
aligning with our mission to transform mental healthcare._

_In this role, you will collaborate closely with cross-functional teams,
inspiring and empowering them to integrate AI seamlessly into our products to
create transformative, data-driven experiences for our users. Whether it's
leveraging the latest machine learning models or exploring emerging AI trends,
your vision and expertise will fuel the development of solutions that redefine
how mental health services are delivered._

_Join us on this exciting journey to revolutionize mental healthcare with AI
and leave a lasting, global impact on health and well-being._

**What you will do:**

    * **Drive AI Vision & Strategy: **Define and execute a strategic roadmap for AI/ML solutions while staying at the forefront of cutting-edge AI practices and developing publishable innovations.
    * **Build Scalable AI Infrastructure:** Develop and maintain a high-performance, user-centric ML platform enabling scalable and flexible AI adoption across the organization.
    * **Ensure Responsible, Ethical AI:** Develop and maintain robust safety and quality controls for AI use in a metal health domain, inclusive of both fully automated and human-in-the-loop mechanisms.
    * **Lead Cross-Functional Collaboration:** Partner with clinicians, statisticians, and other experts to measure and enhance the impact of AI-driven solutions for mental healthcare.
    * **Ensure Operational Excellence:** Optimize training data pipelines and feedback loops, ensuring our AI systems are scalable, secure, and robust, adhering to software development best practices.
    * **Promote Data-Driven Culture:** Foster experimentation and measurement, empowering teams to integrate closely monitored AI/ML capabilities effectively and with confidence.
    * **Collaborate on Integration:** Work closely with other tech teams to align AI infrastructure and operations with broader company systems and infrastructure.

**What you will bring** :

**Required Skills:**

    * **Proven Leadership:** 10+ years of experience building, leading, and managing high-performing, innovative AI, machine learning, and/or data science teams, with a history of successfully delivering impactful, responsible AI-driven solutions at scale.
    * **Technical Expertise:** Deep understanding of machine learning frameworks (e.g., TensorFlow, PyTorch), AI methodologies, and modern engineering tools, with hands-on experience deploying solutions in cloud environments (preferably AWS). A track record of publishing successful AI innovations is highly desirable.
    * **Preferred Domain Expertise:** Experience working in consumer-facing health tech, mental health, or clinical settings, with a strong understanding of the challenges and opportunities in applying empathetic and responsible AI in healthcare, is highly desirable.
    * **Advanced AI Knowledge:** Expertise in implementing multiple AI approaches at scale, including LLMs (productionizing LLM-driven solutions), recommendation systems, reinforcement learning, or advanced optimization techniques.
    * **Platform Development:** Demonstrated ability to design, build, and scale machine learning platforms, architect robust data pipelines, and manage infrastructure and operations to support AI/ML production environments efficiently.
    * **Scalability & Performance:** Experience designing evaluation systems, tests, and feedback loops to ensure AI/ML systems meet scalability, reliability, and performance standards while adhering to modern software development and engineering best practices.
    * **Business Strategy Alignment:** Ability to translate complex AI/ML capabilities into actionable solutions that align with and drive strategic business objectives, ensuring high impact and measurable outcomes.
    * **Collaboration & Influence:** Proven success in collaborating with cross-functional teams, including engineering, product, design, and non-technical stakeholders, to develop and deliver practical, real-world AI solutions.
    * **Team Building & Mentorship:** Strong leadership and management experience, with a focus on recruiting, mentoring, and developing diverse, high-performing technical AI teams in fast-paced environments.

**Pay & Benefits**:

The base salary range for this role is determined by a number of factors,
including but not limited to skills and scope required, relevant licensure and
certifications, and unique relevant experience and job-related skills. The
base salary range for this role is **$198,450 - $270,113**.

At Headspace, cash salary is but one component of our Total Rewards package.
We're proud of our robust package inclusive of: base salary, stock awards,
comprehensive healthcare coverage, monthly wellness stipend, retirement
savings match, lifetime Headspace membership, unlimited, free mental health
coaching, generous parental leave, and much more. Paid performance incentives
are also included for those in eligible roles. Additional details about our
Total Rewards package will be provided during the recruitment process.

**How we feel about Diversity, Equity, Inclusion and Belonging:**

Headspace is committed to bringing together humans from different backgrounds
and perspectives, providing employees with a safe and welcoming work
environment free of discrimination and harassment. We strive to create a
diverse & inclusive environment where everyone can thrive, feel a sense of
belonging, and do impactful work together.

As an equal opportunity employer, we prohibit any unlawful discrimination
against a job applicant on the basis of their race, color, religion, gender,
gender identity, gender expression, sexual orientation, national origin,
family or parental status, disability*, age, veteran status, or any other
status protected by the laws or regulations in the locations where we operate.
We respect the laws enforced by the EEOC and are dedicated to going above and
beyond in fostering diversity across our workplace.

    * _Applicants with disabilities may be entitled to reasonable accommodation under the terms of the Americans with Disabilities Act and certain state or local laws. A reasonable accommodation is a change in the way things are normally done which will ensure an equal employment opportunity without imposing undue hardship on Headspace._ ** _Please inform our Talent team by filling out_** ** _this form_** ** _if you need any assistance completing any forms or to otherwise participate in the application or interview process._**

_Headspace participates in the_ _E-Verify Program_ _._

**_Privacy Statement_**

_All member records are protected according to our_ ___Privacy Policy_ _.
Further, while employees of Headspace (formerly Ginger) cannot access
Headspace products/services, they will be offered benefits according to the
company's benefit plan. To ensure we are adhering to best practice and ethical
guidelines in the field of mental health, we take care to avoid dual
relationships. A dual relationship occurs when a mental health care provider
has a second, significantly different relationship with their client in
addition to the traditional client-therapist relationship --including, for
example, a managerial relationship._

_As such, Headspace requests that individuals who have received coaching or
clinical services at Headspace wait until their care with Headspace is
complete before applying for a position. If someone with a Headspace account
is hired for a position, please note their account will be deactivated and
they will not be able to use Headspace services for the duration of their
employment._

_Further, if Headspace cannot find a role that fails to resolve an ethical
issue associated with a dual relationship, Headspace may need to take steps to
ensure ethical obligations are being adhered to, including a delayed start
date or a potential leave of absence. Such steps would be taken to protect
both the former member, as well as any relevant individuals from their care
team, from impairment, risk of exploitation, or harm._

For how how we will use the personal information you provide as part of the
application process, please see: https://www.headspace.com/applicant-notice"
"https://www.indeed.com/viewjob?jk=7f56e0db1d7d49ae","indeed","Technical Program Manager","Google","https://www.indeed.com/cmp/Google","Sunnyvale, CA, USA","fulltime","2024-12-11","","","","",False,0,"","","**Minimum qualifications:**  

    * Bachelor's degree in a relevant field, or equivalent practical experience.
    * 8 years of experience in program management.
    * 8 years of machine learning work experience.
**Preferred qualifications:**  

    * 8 years of experience managing cross-functional and/or cross-team projects.
About the job  
  
A problem isn’t truly solved until it’s solved for all. That’s why Googlers
build products that help create opportunities for everyone, whether down the
street or across the globe. As a Technical Program Manager at Google, you’ll
use your technical expertise to lead complex, multi-disciplinary projects from
start to finish. You’ll work with stakeholders to plan requirements, identify
risks, manage project schedules, and communicate clearly with cross-functional
partners across the company. You're equally comfortable explaining your team's
analyses and recommendations to executives as you are discussing the technical
tradeoffs in product development with engineers.Our goal is to build a Google
that looks like the world around us — and we want Googlers to stay and grow
when they join us. As part of our efforts to build a Google for everyone, we
build diversity, equity, and inclusion into our work and we aim to cultivate a
sense of belonging throughout the company.  
Google Cloud accelerates every organization’s ability to digitally transform
its business and industry. We deliver enterprise-grade solutions that leverage
Google’s cutting-edge technology, and tools that help developers build more
sustainably. Customers in more than 200 countries and territories turn to
Google Cloud as their trusted partner to enable growth and solve their most
critical business problems.  
The US base salary range for this full-time position is $168,000-$252,000 +
bonus + equity + benefits. Our salary ranges are determined by role, level,
and location. The range displayed on each job posting reflects the minimum and
maximum target salaries for the position across all US locations. Within the
range, individual pay is determined by work location and additional factors,
including job-related skills, experience, and relevant education or training.
Your recruiter can share more about the specific salary range for your
preferred location during the hiring process.  
Please note that the compensation details listed in US role postings reflect
the base salary only, and do not include bonus, equity, or benefits. Learn
more aboutbenefits at Google.  
  
Responsibilities  
  

    * Implement communications standards across a portfolio of programs including executive and key partner communications.
    * Establish a reliable and visible cadence for program reviews, decision-making, prioritization, and Resource Stewardship (effective deployment of machine and people resources) whereby improvements such as efficiency and utilization gains are measurable and the impact can be felt organization wide.
    * Lead a governance structure that drives effective executive decision-making. Ensure governance structure effectively exposes and mitigates dependencies.
    * Seek out and identify change management opportunities that increase program velocity and which affect multiple teams.
    * Define/manage a program portfolio solving problems that target high business impact for the organization and product area.
Google is proud to be an equal opportunity workplace and is an affirmative
action employer. We are committed to equal employment opportunity regardless
of race, color, ancestry, religion, sex, national origin, sexual orientation,
age, citizenship, marital status, disability, gender identity or Veteran
status. We also consider qualified applicants regardless of criminal
histories, consistent with legal requirements. See alsoGoogle's EEO Policy
andEEO is the Law. If you have a disability or special need that requires
accommodation, please let us know by completing ourAccommodations for
Applicants form."
"https://www.indeed.com/viewjob?jk=850e4108632a5b17","indeed","Machine Learning Engineer","Rivian","https://www.indeed.com/cmp/Rivian-3","Palo Alto, CA, USA","fulltime","2024-12-10","yearly",129300.0,161600.0,"USD",False,0,"","candidateaccommodations@rivian.com","About Us:

Rivian is on a mission to keep the world adventurous forever. This goes for
the emissions-free Electric Adventure Vehicles we build, and the curious,
courageous souls we seek to attract.

  
As a company, we constantly challenge what's possible, never simply accepting
what has always been done. We reframe old problems, seek new solutions and
operate comfortably in areas that are unknown. Our backgrounds are diverse,
but our team shares a love of the outdoors and a desire to protect it for
future generations.

Role Summary:

In this position within Platform Architecture team, you will work closely with
Software, Hardware, System, and SoC groups to develop the infrastructure to
enable state-of-the-art machine learning models used in ADAS systems to be
efficiently performing and running on the SoC. This infrastructure enables HW-
SW codesign and would result in developing efficient building blocks for
state-of-the-art machine learning models. You will be collaborating with other
cross functional teams in understanding the workloads, enabling running
workloads on HW and help define the future enhancements to hardware and
models.

Responsibilities:

    * Take various versions of ADAS perception models (development, production, prototype) and map them to SoC; this would involve graph and operator transformations and making the new graph perform efficiently on SoC.
    * Create/Improve exiting QAT infrastructure.
    * Quantize models to different data precisions (4b, 8b, 16b) while preserving originally FP32 accuracy
    * Compress models using structured sparsity schemes
Qualifications:

    * BS in Electrical Engineering, Computer Science, or relevant field
    * Expertise or prior work experience in one of the following areas: Quantization of Neural Networks, Sparsity of Neural Networks, Training of Neural Networks
    * Exposure to Transformers and LLMs is a plus.
    * Experience with ADAS specific workload dealing with Nuscenes, Waymo datasets is a plus.
    * Demonstrate proficiency in C++, Python, Numpy, Pytorch framework.
    * Excellent debugging and analytical skills, written and verbal communication skills, and a strong team player
Pay Disclosure:

**Salary Range for California Based Candidates:** $129,300.00 - $161,600.00
(actual compensation will be determined based on experience, location, and
other factors permitted by law).

 **  
Benefits Summary:** Rivian provides robust medical/Rx, dental and vision
insurance packages for full-time employees, their spouse or domestic partner,
and children up to age 26. Coverage is effective on the first day of
employment, and Rivian covers most of the premiums.

Company Statements:

#### **Equal Opportunity**

Rivian is an equal opportunity employer and complies with all applicable
federal, state, and local fair employment practices laws. All qualified
applicants will receive consideration for employment without regard to race,
color, religion, national origin, ancestry, sex, sexual orientation, gender,
gender expression, gender identity, genetic information or characteristics,
physical or mental disability, marital/domestic partner status, age,
military/veteran status, medical condition, or any other characteristic
protected by law.

  
Rivian is committed to ensuring that our hiring process is accessible for
persons with disabilities. If you have a disability or limitation, such as
those covered by the Americans with Disabilities Act, that requires
accommodations to assist you in the search and application process, please
email us at candidateaccommodations@rivian.com.

####  **Candidate Data Privacy**

Rivian may collect, use and disclose your personal information or personal
data (within the meaning of the applicable data protection laws) when you
apply for employment and/or participate in our recruitment processes
(""Candidate Personal Data""). This data includes contact, demographic,
communications, educational, professional, employment, social media/website,
network/device, recruiting system usage/interaction, security and preference
information. Rivian may use your Candidate Personal Data for the purposes of
(i) tracking interactions with our recruiting system; (ii) carrying out,
analyzing and improving our application and recruitment process, including
assessing you and your application and conducting employment, background and
reference checks; (iii) establishing an employment relationship or entering
into an employment contract with you; (iv) complying with our legal,
regulatory and corporate governance obligations; (v) recordkeeping; (vi)
ensuring network and information security and preventing fraud; and (vii) as
otherwise required or permitted by applicable law.

  
Rivian may share your Candidate Personal Data with (i) internal personnel who
have a need to know such information in order to perform their duties,
including individuals on our People Team, Finance, Legal, and the team(s) with
the position(s) for which you are applying; (ii) Rivian affiliates; and (iii)
Rivian's service providers, including providers of background checks, staffing
services, and cloud services.

  
Rivian may transfer or store internationally your Candidate Personal Data,
including to or in the United States, Canada, the United Kingdom, and the
European Union and in the cloud, and this data may be subject to the laws and
accessible to the courts, law enforcement and national security authorities of
such jurisdictions.

 **  
Please note that we are currently not accepting applications from third party
application services.**"
